{
  "$schema": "https://json-schema.org/draft/2020-12/schema",
  "$id": "https://roaringlions.dev/schemas/map.schema.json",
  "title": "Map",
  "description": "A battlefield: a character grid plus named markers and zones. One character per tile \u2014 '.' open, '1'/'2'/'3' cover levels (light/heavy/garrison), 'r' road, 'o' olive grove, 'n' rocky knoll, '^' rock ridge (impassable, blocks sight), 'b' boulder field (open on foot, impassable to wheels and tracks), 'd' anti-tank ditch (the same, dug rather than natural), and any building symbol declared in data/structures.json. Authorable in a text editor on purpose: maps are the scatter-prop and sightline budget of a mission, and contributors should be able to sketch one without tooling. The loader (packages/data parseMap) additionally checks that row counts and lengths match the declared dimensions and that markers/zones are in bounds.",
  "type": "object",
  "required": [
    "id",
    "name",
    "width",
    "height",
    "rows"
  ],
  "additionalProperties": false,
  "properties": {
    "id": {
      "type": "string",
      "pattern": "^[a-z0-9_]+$"
    },
    "name": {
      "type": "string"
    },
    "width": {
      "type": "integer",
      "minimum": 8,
      "maximum": 128
    },
    "height": {
      "type": "integer",
      "minimum": 8,
      "maximum": 128
    },
    "rows": {
      "type": "array",
      "minItems": 8,
      "items": {
        "type": "string",
        "pattern": "^\\S+$",
        "description": "One character per tile. Terrain: \".\" open, \"1\"-\"3\" cover levels, \"r\" dirt road, \"o\" olive grove (cover 1), \"n\" rocky knoll (cover 2), \"^\" rock ridge (impassable, no cover, blocks line of sight -- the only blocked tile that is not a building, and therefore the only one with no HP, no garrison and no ROE penalty), \"b\" boulder field and \"d\" anti-tank ditch and \"~\" marsh (all open ground on foot and impassable to anything wheeled or tracked -- the only symbols whose passability depends on WHO is asking; \"b\" and \"d\" carry nothing else: no cover, no sight-blocking, no HP, not destructible, while \"~\" also carries cover 1 like \"o\" and is legal on terrain \"wetland\" only, a rule validate_data.mjs enforces; they differ in what the renderer draws, which is why \"d\" and \"~\" reuse \"b\"'s mask and cost the sim nothing). Building symbols are whatever data/structures.json declares -- a contiguous run of identical building symbols is one structure. The pattern here is deliberately permissive: listing symbols in a regex meant they were hardcoded in three places at once, and validate_data.mjs now cross-checks every symbol against the structure catalogue and the terrain legend instead, so it cannot drift. A prior version of this pattern still hardcoded an alphanumeric-plus-# allowlist, which silently excluded punctuation symbols like the wall type's \"=\" -- the same drift the refactor was meant to prevent. Any single non-whitespace character is legal here; the catalogue and terrain legend are the only real authority on which ones mean something."
      }
    },
    "terrain": {
      "type": "string",
      "enum": ["arid", "green", "highland", "wetland"],
      "default": "arid",
      "description": "Terrain theme: which tone bundle and ground texture the renderer draws this map with. Presentation only -- it never reaches the sim, exactly like the decor layer. 'arid' is the Sahar limestone-and-dust look every map before Naharin uses; 'green' is the Naharin river basin; 'highland' is the Sur front (GH-322): terra rossa earth between grey limestone, cedars on the slopes, scree and outcrops. validate_data.mjs requires 'highland' on every map a Sur mission uses. 'wetland' is a Levantine valley in the early-spring flush, where rain belongs to the theme (Free Play only, GH-871). Adding a theme is a renderer change; adding a map that uses one is not."
    },
    "grove": {
      "type": "string",
      "enum": ["olive", "desert", "cedar"],
      "description": "Which tree species this map's 'o' grove tiles draw, overriding the terrain theme's own (arid: desert, green: olive, highland: cedar). Presentation only. Absent means the theme's species. Umm Zeitoun sets 'olive': its groves are its olive terraces by name, while the rest of the highland around them grows cedar."
    },
    "backdrop": {
      "type": "object",
      "additionalProperties": false,
      "required": ["valley", "crest", "seed", "kit", "pieces"],
      "description": "Valley walls drawn BEYOND the map edge instead of the flat skirt (Wadi Halam look, GH-161). Presentation only: read by the app and the renderer, never by the sim. 'valley' is the axis the valley runs along ('ns' = along the rows: walls beyond the west and east edges) and 'crest' the wall height in elevation levels, both inputs of the layout tool; 'seed' seeds the floor's mottle. 'kit' is the kit GLB (art/meshes/backdrop/<kit>.glb) and 'pieces' the explicit placement list, written by `pnpm backdrop:layout` and then hand-edited. A map with no block draws the skirt it always did.",
      "properties": {
        "valley": { "type": "string", "enum": ["ns", "ew"] },
        "crest": { "type": "integer", "minimum": 8, "maximum": 80 },
        "seed": { "type": "integer" },
        "kit": { "type": "string", "pattern": "^[a-z][a-z0-9_]*$" },
        "pieces": {
          "type": "array",
          "minItems": 1,
          "description": "One entry per placed kit piece. 'at' is the midpoint of the piece's map-facing edge, in map tiles (outside the playable rectangle); 'rot' 0/90/180/270 stands the piece on the west/north/east/south side; 'ys' scales its height (0.75-1.35); 'lift' raises its local zero above the floor, in tiles (a crest on a wall, a terrace on a hillside).",
          "items": {
            "type": "object",
            "additionalProperties": false,
            "required": ["id", "at", "rot"],
            "properties": {
              "id": { "type": "string", "pattern": "^bd_[a-z0-9_]+$" },
              "at": { "type": "array", "items": { "type": "number" }, "minItems": 2, "maxItems": 2 },
              "rot": { "enum": [0, 90, 180, 270] },
              "mirror": { "type": "boolean" },
              "ys": { "type": "number", "minimum": 0.75, "maximum": 1.35 },
              "lift": { "type": "number", "minimum": 0, "maximum": 30 }
            }
          }
        }
      }
    },
    "elevation": {
      "type": "array",
      "description": "Per-tile elevation, one digit 0-9 per tile, with the same dimensions as rows. Absent means every tile is height 0. Deliberately orthogonal to the terrain symbol: a symbol table can express ridges but not valleys, and elevation needs both. 0-4 is the practical authoring range -- deeper relief reads as a wall rather than as terrain -- but 0-9 is legal so a dramatic peak needs no format change.",
      "items": { "type": "string", "pattern": "^[0-9]+$" }
    },
    "markers": {
      "type": "object",
      "description": "Named points missions reference: spawn anchors, tunnel mouths, HVT positions.",
      "additionalProperties": {
        "type": "array",
        "items": {
          "type": "integer",
          "minimum": 0
        },
        "minItems": 2,
        "maxItems": 2
      }
    },
    "zones": {
      "type": "object",
      "description": "Named rects [x, y, w, h]: objective areas, trigger regions, no-fire zones.",
      "additionalProperties": {
        "type": "array",
        "items": {
          "type": "integer",
          "minimum": 0
        },
        "minItems": 4,
        "maxItems": 4
      }
    },
    "tunnels": {
      "type": "array",
      "description": "Underground routes. Geometry lives here because it is terrain; a mission activates a route and stocks it, and a route no mission references does not exist that mission.",
      "items": {
        "type": "object",
        "additionalProperties": false,
        "required": ["id", "mouth", "vent"],
        "properties": {
          "id": { "type": "string" },
          "mouth": { "type": "array", "items": { "type": "integer" }, "minItems": 2, "maxItems": 2 },
          "waypoints": {
            "type": "array",
            "items": { "type": "array", "items": { "type": "integer" }, "minItems": 2, "maxItems": 2 }
          },
          "vent": { "type": "array", "items": { "type": "integer" }, "minItems": 2, "maxItems": 2 },
          "dig_tiles_per_s": { "type": "number", "exclusiveMinimum": 0, "default": 0.15 },
          "pre_dug": {
            "type": "boolean",
            "default": false,
            "description": "The route starts fully excavated: dig progress at full length, vent open. One of the two ways authored data opens a route -- the other is a mission placement whose digs field names it, excavating live and leaving spoil. No trail is stamped at load: spoil is what digging leaves behind, and a route finished before the mission began has weathered -- reveal it with mark_tunnel or the ledger."
          }
        }
      }
    }
  }
}
