{
  "id": "umm_zeitoun_3",
  "name": "Umm Zeitoun — Between the Horns",
  "width": 48,
  "height": 48,
  "terrain": "highland",
  "grove": "olive",
  "markers": {
    "kdf_start": [
      24,
      45
    ],
    "rim_crest": [
      24,
      41
    ],
    "civ_refuge": [
      23,
      37
    ],
    "hamlet_square": [
      24,
      26
    ],
    "horn_west": [
      6,
      25
    ],
    "horn_east": [
      42,
      25
    ],
    "battery_south": [
      30,
      30
    ],
    "battery_west": [
      12,
      17
    ],
    "crest": [
      14,
      7
    ],
    "sarim_north": [
      24,
      3
    ],
    "sarim_east": [
      44,
      14
    ],
    "sarim_west": [
      3,
      14
    ],
    "wounded_evac": [
      23,
      46
    ]
  },
  "zones": {
    "refuge_wadi": [
      21,
      36,
      5,
      3
    ],
    "hamlet": [
      16,
      18,
      17,
      12
    ],
    "horn_west": [
      4,
      23,
      5,
      5
    ],
    "horn_east": [
      40,
      23,
      5,
      5
    ]
  },
  "rows": [
    "^^^^^^^^^^^^^^^^^^^^^^^^^^^^^^^^^^^^^^^^^^^^^^^^",
    "^^^^^^^^^^^^^^^^^^^^^^^^^^^^^^^^^^^^^^^^^^^^^^^^",
    "^^^^^^^^.....^^^^^^^^^^^^.....^^^^^^^^^^^^.....^",
    "^^^^^^.........^^^^^^^^.........^^^^^^^^........",
    "^^^^.......^...n.^^^^.............^^^^..........",
    ".........n^n....^n..............................",
    ".........^nn...^nn......r.......................",
    ".........nn^...nn^......r.......................",
    ".........n^n...n^n......r.......................",
    "...........n...^...ooooorooo....................",
    "................ooooooooroooooo.................",
    "...............ooooo..o.roooo.oo....o...........",
    ".............ooo.oooooorroooooooo.oooo..........",
    "............oooooooooooroooooooo.oo.o.oo........",
    "^^^........oooooooooooor.oo.ooo.ooooooooo....^^^",
    "^^^..........ooo...oo.oro.oo.ooo.ooooooo......^^",
    "^^^..........ooo.......r...ooo..ooooooo.......^^",
    "^^.....................r.....oo.o...o........^^^",
    "^.....bbb......========r=========............^^^",
    "^...bbbbbbb....=.....hhr.hhh....=.....1.....^^^^",
    "^^bbbbbbbbbbb..=.hhh..rr.hhh..ss=.........ww^^^^",
    "^^bbbbbbbbbbb..=.hhh..s.........=.........ww^^^^",
    "^bbbbbbbbbbbbb.=.s....r....h.hh.=...........^^^^",
    "^bbbbbnbbbbbbb.=.....srr...h.hh.=............^^^",
    "bbbbbnnnbbbbbrrrrhh....r........=..........nn.^^",
    "bbbbnn.nnbbrrrb=.hhrrr.rr...ss..=....rrrr...n.^^",
    "bbbbbnnnbbbbbbb=.hh..rrrrrrrrrrrrrrrrr.....nn^^^",
    "^bbbbbnbbbbbbb.=.......rr......s=............^^^",
    "^bbbbbbbbbbbbb.=...hhh.rhhh.hh..=...........^^^^",
    "^^bbbbbbbbbbb..=...hhh.rhhh.hh..=.1........^^^^^",
    "^^bbbbbbbbbbb..=======.r...===.............^^^^^",
    "^...bbbbbbb............rr........nnn........^^^^",
    "^.....bbboooo.....ooo...r......nnnnnnn.......^^^",
    "^......ooo.ooo...oo.oo..r...1..nnnssnn........^^",
    "^^......ooooo..bbbb.o...r......nnnnnnn........^^",
    "^^^.....bbbbbbbbbbb.....r......nnnnnnn.bbbbbb^^^",
    "^^^bbbbbbbbbbbbbbbb.1...r.......bbbbbbbbbbbbb^^^",
    "bbbbbbbbbbbbbbb.........r.......bbbbbbbbbbbbbb..",
    "bbbbbbbb................r.......bbbbbbb.........",
    "........................r.......................",
    ".........1..............r.1.....................",
    ".....bbbbb..............r.......................",
    ".....bbbbb..........1...r........======.1.......",
    ".....bbbbb..............r.....1.......=.........",
    "........................r..........ss.=.........",
    "........................r.............=.........",
    "................................................",
    "................................................"
  ],
  "elevation": [
    "666666666666666666666666666666666666666666666666",
    "666666666666666666666666666666666666666666666666",
    "666666661111166666666666611111666666666666111116",
    "666666111111111666666661111111116666666611111111",
    "666611111125232226666111111111111166661111111111",
    "111111111263444362111111111111111111111111111111",
    "111111112644444743211111111111111111111111111111",
    "111111112347444446211111111111111111111111111111",
    "111111112374444473211111111111111111111111111111",
    "111111111233444632111111111111111111111111111111",
    "111111111122232221111111111111111111111111111111",
    "111111111111111111111111111111111111111111111111",
    "111111111111111111111111111111111111111111111111",
    "111111111111111111111111111111111111111111111111",
    "444111111111111111111111111111111111222222222555",
    "444111111111111111111111111111111122222222333366",
    "444111211111111111112222222221111222222333333366",
    "442222222221111111222333333322211222223333333666",
    "422333333322111122333333333333322222233333444777",
    "533444444433211223333333333333332222233334447777",
    "664445554443322233333333333333333222333344447777",
    "674555555544322333333333333333333322333344447777",
    "745555655554433333333333333333333332333444447777",
    "745566666554433333333333333333333333333444555888",
    "455566666555433333333333333333333333334445555588",
    "455666666655433333333333333333333333334445555588",
    "455566666555433333333333333333333333334445555888",
    "745566666554432333333333333333333323333444555888",
    "745555655554432233333333333333333222333444447777",
    "674555555544322223333333333333332222333344477777",
    "664445554443321122333333333333322222333344477777",
    "533444444433211111222333333322211222233334447777",
    "422333333322111111112222222221111222233333444777",
    "412222222221111111111111111111111233223333333366",
    "441111211111110000000000111111111222222333333366",
    "444111100000000000000000000000111122222222333666",
    "333000000000000000000000000000111111222222222555",
    "000000000000000111111110000000000000000000000001",
    "000000000111111111111111222222000000000022211111",
    "222221111111111111222222333333333333333333322222",
    "333332222222222222333333333333333333333333333333",
    "333333333333333333333333333222222222222233333333",
    "223333333333333333333222222111111111111122222233",
    "112222222222222222222111111111111111111111111122",
    "111111111111111111111111111111111111111111111111",
    "111111111111111111111111111111111111111111111111",
    "111111111111111111111111111111111111111111111111",
    "111111111111111111111111111111111111111111111111"
  ]
}
