{
  "id": "tile_orchard",
  "name": "Tile Study — Orchard Floor",
  "width": 48,
  "height": 48,
  "rows": [
    "................................................",
    "................................................",
    "................................................",
    "................................................",
    "........................r.......................",
    "........................r.......................",
    "........................r.......................",
    "........................r.......................",
    "........................r.......................",
    "........................r.......................",
    "........................r.......................",
    "........................r.......................",
    "..............ooooooooooroooooooooo.............",
    "..............ooooooooooroooooooooo.............",
    "..............ooooooooooroooooooooo.............",
    "..............ooooooooooroooooooooo.............",
    "..............ooooooooooroooooooooo.............",
    "..............ooooooooooroooooooooo.............",
    "..............ooooooooooroooooooooo.............",
    "..............ooooooooooroooooooooo.............",
    "..............ooooooooooroooooooooo.............",
    "..............ooooooooooroooooooooo.............",
    "..............ooooooooooroooooooooo.............",
    "..............ooooooooooroooooooooo.............",
    "..............rrrrrrrrrrrrrrrrrrrrr.............",
    "..............ooooooooooroooooooooo.............",
    "..............ooooooooooroooooooooo.............",
    "..............ooooooooooroooooooooo.............",
    "..............ooooooooooroooooooooo.............",
    "..............ooooooooooroooooooooo.............",
    "..............ooooooooooroooooooooo.............",
    "..............ooooooooooroooooooooo.............",
    "..............ooooooooooroooooooooo.............",
    "..............ooooooooooroooooooooo.............",
    "..............ooooooooooroooooooooo.............",
    "........................r.......................",
    "........................r.......................",
    "........................r.......................",
    "........................r.......................",
    "........................r.......................",
    "........................r.......................",
    "........................r.......................",
    "........................r.......................",
    "........................r.......................",
    "........................r.......................",
    "................................................",
    "................................................",
    "................................................"
  ],
  "markers": {
    "kdf_start": [
      6,
      24
    ],
    "objective": [
      34,
      26
    ],
    "civ_refuge": [
      4,
      42
    ],
    "grove_nw": [
      16,
      14
    ],
    "grove_centre": [
      20,
      24
    ],
    "grove_crossroads": [
      24,
      24
    ]
  }
}
