{
  "id": "wadi_tarfan",
  "name": "Wadi Tarfan — The Three Fords",
  "width": 48,
  "height": 48,
  "terrain": "arid",
  "markers": {
    "versus_0": [10, 10],
    "versus_1": [37, 37],
    "centre": [23, 23],
    "centre_ford": [24, 24],
    "ne_ford": [34, 13],
    "sw_ford": [13, 34],
    "bluff_near_0": [14, 22],
    "bluff_near_1": [33, 25],
    "bluff_far_0": [32, 7],
    "bluff_far_1": [15, 40],
    "farm_near_0": [27, 17],
    "farm_near_1": [20, 30],
    "farm_far_0": [6, 38],
    "farm_far_1": [41, 9]
  },
  "zones": {
    "centre_ford": [20, 20, 8, 8],
    "ne_ford": [31, 10, 7, 7],
    "sw_ford": [10, 31, 7, 7],
    "camp_0": [5, 1, 10, 19],
    "camp_1": [33, 28, 10, 19],
    "bluff_near_0": [11, 19, 7, 7],
    "bluff_near_1": [30, 22, 7, 7],
    "bluff_far_0": [29, 4, 7, 7],
    "bluff_far_1": [12, 37, 7, 7],
    "farm_near_0": [24, 14, 7, 7],
    "farm_near_1": [17, 27, 7, 7],
    "farm_far_0": [3, 35, 7, 7],
    "farm_far_1": [38, 6, 7, 7]
  },
  "rows": [
    "............................n.nnn....bbbbbbbbbbb",
    "...........................nnnnn.n..bbbbbbbbbbbd",
    ".............................nn.n..bbb.bbbbddddd",
    "...............................nn.bb....ddddd...",
    "..............................n.nbb...dddd......",
    "................................bbb..ddd.oo.....",
    "...............................nbb..dd..o..11...",
    ".................................b..dd...111....",
    "n..........nn......................ddoo.r===1...",
    "...........nn......................d.orr=....111",
    ".........nrnn......................dor11srhh.1..",
    ".........rnrn..............1.......dro...rhh1...",
    "........r.nnr..............1....rrrr..o..r.o....",
    ".......r.....r..........o..o...r.........r..o...",
    "......r.......r..........o....r..........r......",
    ".....r.........r.....rrrrhh...ro.d.......r......",
    "....r...........r...r.11.hhrs.r.^dd.......r.....",
    "....r............r.r.......r=r.^bd.........r....",
    "....r.............r......===r...dd.........r....",
    "....r..............r......1....dd..b......nr.n..",
    "....r...............r.p..1.....dd..bb....n.rnn..",
    "....r.........n......r.......dddo.bbb.....nrnn..",
    "...nrs=......n.bb.....r....ddddo..bb......nrnn..",
    "...nr.=......nbbb.o....r..dddooo.bb........rnn..",
    "..nnr........bb.oooddd..r....o.bbbn......=.rn...",
    "..nnrn......bb..odddd....r.....bb.n......=srn...",
    "..nnrn.....bbb.oddd.......r......n.........r....",
    "..nnr.n....bb..dd.....1..p.r...............r....",
    "..n.rn......b..dd....1......r..............r....",
    "....r.........dd...r===......r.............r....",
    "....r.........db^.r=r.......r.r............r....",
    ".....r.......dd^.r.srhh.11.r...r...........r....",
    "......r.......d.or...hhrrrr.....r.........r.....",
    "......r..........r....o..........r.......r......",
    "...o..r.........r...o..o..........r.....r.......",
    "....o.r..o..rrrr....1..............rnn.r........",
    "...1hhr...ord.......1..............nrnr.........",
    "..1.hhrs11rod......................nnrn.........",
    "111....=rro.d......................nn...........",
    "...1===r.oodd......................nn..........n",
    "....111...dd..b.................................",
    "...11..o..dd..bbn...............................",
    ".....oo.ddd..bbb................................",
    "......dddd...bbn.n..............................",
    "...ddddd....bb.nn...............................",
    "dddddbbbb.bbb..n.nn.............................",
    "dbbbbbbbbbbb..n.nnnnn...........................",
    "bbbbbbbbbbb....nnn.n............................"
  ],
  "elevation": [
    "333333333333333333333333333333333332222111111000",
    "333333333333333333333333333333333322221110000000",
    "333333333333333333333333333333333222110000000000",
    "333333333333333333333333333333334421100000000000",
    "333333333333333333333333333333344421000000000000",
    "333333333333333333333333333333244410000000001111",
    "333333333333333333333333333322244100000000111111",
    "333333333333333333333333333222244100000111111111",
    "333333333333333333333333322222241100000111111111",
    "333333333333333333333333222222111000001111111112",
    "333333333333333333333332222221111000001111111122",
    "333333333333333333333322222211111000011111111222",
    "333333333333333333333222222111111000011111111222",
    "333333333333333333332222221111110000011111222222",
    "333333333333333333322222111111110000011112222222",
    "333333333333333333222222111111110000111122222223",
    "333333333333333333222222111111100000111222222233",
    "333333333333333332222221111111100000111222223333",
    "333333333333333322222211111111000000112222233333",
    "333333333333333222222111111111000001122222333333",
    "333333333333332444221111111000000001222223333333",
    "333333333333344444111111100000000011222233333333",
    "333333333333444441111000000000000012222333333333",
    "333333333332444111000000000000001122223333333333",
    "333333333322221100000000000000111444233333333333",
    "333333333222210000000000000111144444333333333333",
    "333333332222110000000001111111444443333333333333",
    "333333322222100000000111111122444233333333333333",
    "333333222221100000111111111222222333333333333333",
    "333332222211000000111111112222223333333333333333",
    "333322222111000001111111122222233333333333333333",
    "332222222111000001111111222222333333333333333333",
    "322222221111000011111111222222333333333333333333",
    "222222211110000011111111222223333333333333333333",
    "222222111110000011111122222233333333333333333333",
    "222111111110000111111222222333333333333333333333",
    "222111111110000111112222223333333333333333333333",
    "221111111100000111122222233333333333333333333333",
    "211111111100000111222222333333333333333333333333",
    "111111111000001142222223333333333333333333333333",
    "111111111000001442222333333333333333333333333333",
    "111111000000001442223333333333333333333333333333",
    "111100000000014442333333333333333333333333333333",
    "000000000000124443333333333333333333333333333333",
    "000000000001124433333333333333333333333333333333",
    "000000000011222333333333333333333333333333333333",
    "000000011122223333333333333333333333333333333333",
    "000111111222233333333333333333333333333333333333"
  ]
}
