{
  "id": "deir_amun",
  "name": "Deir Amun",
  "width": 48,
  "height": 48,
  "terrain": "arid",
  "rows": [
    "................................................",
    "......nnnnnnn.......sss...........nnnnnnnnn.....",
    "......nnnnnnn.......sss...........nnnnnnnnn.....",
    "......nnnnnnn.....................nnnnnnnnn.....",
    "....rrrrrrrrrrrrrrrrrrrrrrrrrrrrrrrrrrrrrrrrr...",
    "................................................",
    "..22222....................................2222.",
    "..22222....................................2222.",
    "^^^^^^^^^^^^^^^.......^^^^^^^^^........^^^^^^^^^",
    "^^^^^^^^^^^^^^^.......^^^^^^^^^........^^^^^^^^^",
    "^^^^^^^^^^^^^^^.......^^^^^^^^^........^^^^^^^^^",
    "...............2222222.........22222222.........",
    "...............2222222.........22222222.........",
    "...................................======r......",
    "...............11111...............=wwww=r......",
    ".......ssbbb...11111...............=wwww=r......",
    ".......ssbbb..........nnnnnnnnnnnnn=wwww=r......",
    ".........bbb..........nnnnnnnnnnnnn==.===r......",
    "......111bbb..........nnnnnnnnnnnnn......r11111.",
    "......111bbb......rrrrrrrrrrrrrrrrrrrrrrrr11111.",
    ".........bbb......hhh.....ssr.hhh........r11111.",
    ".........bbb......hhh.hhh.ssr.hhh.s......r......",
    ".........bbb......hhh.hhh...r.....s......r......",
    ".........bbb..........hhhhhhr............r......",
    ".........bbb======.......hhhr.www........r......",
    ".........bbb=###.=ss..##.hhhr.www..hhh...r......",
    ".........bbb=###.=ss..##....r.www..hhh...r......",
    ".........bbb=###.=..........r............r......",
    ".........bbb===.==..........r............r......",
    "222222222bbb2222222222222222r222222222222r222222",
    "bbbbbbbbbbbbbb...bbbbbbbbbb.r.bbbbbbbbbb.r.bbbbb",
    "bbbbbbbbbbbbbb...bbbbbbbbbb.r.bbbbbbbbbb.r.bbbbb",
    "bbbbbbbbbbbbbb...bbbbbbbbbb.r.bbbbbbbbbb.r.bbbbb",
    "2222222222222222222222222222r222222222222r222222",
    "............................r............r......",
    "...222222.........ooooooooo.r............r.2222.",
    "...222222.........ooooooooo.r...ooooooo..r.2222.",
    "...222222.........ooooooooo.r...ooooooo..r.2222.",
    "..................ooooooooo.r...ooooooo..r.2222.",
    "............................r............r......",
    "............11111...........r....111111..r......",
    "............11111...........r....111111..r......",
    "............11111...........r....111111..r......",
    "............................r............r......",
    "............................r............r......",
    "....................11111111r11..........r......",
    "....................11111111r11..........r......",
    "............................r............r......"
  ],
  "elevation": [
    "444444444444444444444444444444444444444444444444",
    "444444555555544444444444444444444455555555544444",
    "444444555555544444444444444444444455555555544444",
    "444444555555544444444444444444444455555555544444",
    "444444444444444444444444444444444444444444444444",
    "444444444444444444444444444444444444444444444444",
    "444444444444444444444444444444444444444444444444",
    "444444444444444444444444444444444444444444444444",
    "444444444444444444444444444444444444444444444444",
    "444444444444444444444444444444444444444444444444",
    "444444444444444444444444444444444444444444444444",
    "333333333333333333333333333333333333333333333333",
    "333333333333333333333333333333333333333333333333",
    "333333333333333333333333333333333333333333333333",
    "333334444222233333333333333333333333333333333333",
    "333334442000233333333333333333333333333333333333",
    "333334442000233333333344444444444443333333333333",
    "333334442000233333333344444444444443333333333333",
    "333334442000233333333344444444444443333333333333",
    "333334442000233333333333333333333333333333333333",
    "333334442000233333333333333333333333333333333333",
    "333333332000233333333333333333333333333333333333",
    "333333332000233333333333333333333333333333333333",
    "333333332000233333333333333333333333333333333333",
    "333333332000233333333333333333333333333333333333",
    "333333332000233333333333333333333333333333333333",
    "333333332000233333333333333333333333333333333333",
    "333333332000233333333333333333333333333333333333",
    "333333332000233333333333333333333333333333333333",
    "222222222000222222222222222222222222222222222222",
    "000000000000000000000000000000000000000000000000",
    "000000000000000000000000000000000000000000000000",
    "000000000000000000000000000000000000000000000000",
    "222222222222222222222222222222222222222222222222",
    "222222222222222222222222222222222222222222222222",
    "222222222222222222111111111222222222222222222222",
    "222222222222222222111111111222221111111222222222",
    "222222222222222222111111111222221111111222222222",
    "111111111111111111111111111111111111111111111111",
    "111111111111111111111111111111111111111111111111",
    "111111111111111111111111111111111111111111111111",
    "111111111111111111111111111111111111111111111111",
    "111111111111111111111111111111111111111111111111",
    "111111111111111111111111111111111111111111111111",
    "111111111111111111111111111111111111111111111111",
    "111111111111111111111111111111111111111111111111",
    "111111111111111111111111111111111111111111111111",
    "111111111111111111111111111111111111111111111111"
  ],
  "markers": {
    "da_start": [
      24,
      44
    ],
    "ford_west": [
      15,
      31
    ],
    "ford_centre": [
      28,
      31
    ],
    "ford_east": [
      41,
      31
    ],
    "wadi_bend": [
      20,
      31
    ],
    "tributary_lip": [
      12,
      22
    ],
    "pump_gate": [
      15,
      28
    ],
    "pump_yard_floor": [
      16,
      26
    ],
    "hamlet_lane": [
      28,
      23
    ],
    "hamlet_north": [
      28,
      19
    ],
    "spoil_field_centre": [
      28,
      17
    ],
    "store_gate": [
      37,
      17
    ],
    "store_road": [
      41,
      15
    ],
    "da_west_head": [
      7,
      17
    ],
    "gap_west": [
      18,
      9
    ],
    "gap_east": [
      34,
      9
    ],
    "north_road": [
      24,
      4
    ],
    "plateau_west": [
      9,
      2
    ],
    "plateau_east": [
      38,
      2
    ],
    "da_west_edge": [
      1,
      19
    ],
    "da_east_edge": [
      46,
      19
    ],
    "wounded_evac": [
      21,
      44
    ]
  },
  "zones": {
    "staging": [
      18,
      40,
      14,
      8
    ],
    "the_wadi": [
      0,
      29,
      48,
      5
    ],
    "pump_yard": [
      12,
      23,
      7,
      6
    ],
    "hamlet": [
      18,
      20,
      17,
      8
    ],
    "spoil_field": [
      22,
      16,
      13,
      3
    ],
    "store_yard": [
      35,
      12,
      7,
      7
    ],
    "da_west": [
      5,
      14,
      9,
      7
    ],
    "north_slope": [
      3,
      8,
      43,
      5
    ]
  },
  "tunnels": [
    {
      "id": "da_tn_west",
      "mouth": [
        9,
        17
      ],
      "waypoints": [
        [
          10,
          22
        ]
      ],
      "vent": [
        10,
        28
      ],
      "dig_tiles_per_s": 0.16
    },
    {
      "id": "da_tn_pump",
      "mouth": [
        16,
        26
      ],
      "waypoints": [
        [
          18,
          28
        ]
      ],
      "vent": [
        20,
        30
      ],
      "dig_tiles_per_s": 0.16
    },
    {
      "id": "da_tn_lane",
      "mouth": [
        20,
        23
      ],
      "waypoints": [
        [
          23,
          20
        ]
      ],
      "vent": [
        27,
        18
      ],
      "pre_dug": true
    },
    {
      "id": "da_tn_yard",
      "mouth": [
        25,
        26
      ],
      "waypoints": [
        [
          29,
          24
        ]
      ],
      "vent": [
        33,
        21
      ],
      "pre_dug": true
    },
    {
      "id": "da_tn_north",
      "mouth": [
        30,
        22
      ],
      "waypoints": [
        [
          32,
          17
        ]
      ],
      "vent": [
        34,
        13
      ],
      "pre_dug": true
    },
    {
      "id": "da_tn_east",
      "mouth": [
        33,
        25
      ],
      "waypoints": [
        [
          37,
          23
        ]
      ],
      "vent": [
        41,
        19
      ],
      "pre_dug": true
    }
  ]
}
