{
 "id": "tel_marum_1",
 "name": "Tel Marum — The Long Valley",
 "width": 48,
 "height": 48,
 "terrain": "highland",
 "markers": {
  "start_line": [
   24,
   44
  ],
  "hollow": [
   24,
   29
  ],
  "approach": [
   24,
   24
  ],
  "notch": [
   24,
   13
  ],
  "ford_west": [
   14,
   32
  ],
  "ford_mid": [
   24,
   39
  ],
  "ford_east": [
   34,
   33
  ],
  "spur_west": [
   15,
   19
  ],
  "spur_east": [
   33,
   15
  ],
  "battery_position": [
   25,
   6
  ],
  "town_edge": [
   25,
   2
  ],
  "drone_0": [
   24,
   25
  ],
  "drone_1": [
   38,
   28
  ],
  "drone_2": [
   45,
   22
  ],
  "drone_3": [
   45,
   10
  ],
  "drone_standoff": [
   36,
   5
  ],
  "wounded_evac": [
    23,
    46
  ]
 },
 "zones": {
  "approach": [
   21,
   22,
   7,
   5
  ],
  "muster_ground": [
   22,
   42,
   5,
   4
  ]
 },
 "rows": [
  "........................rr......................",
  "........................rr......................",
  "........................rr........hh............",
  "..............hh........rr.....h................",
  "........................rr......................",
  "..........h.............rr..........h...........",
  ".................h......rr......................",
  "........................rr......................",
  "........^^^^^^^^^^^^^^^rrrr^^^^^^^^^^^^^........",
  "........^^^^^^^^^^^^^^^rrrr^^^^^^^^^^^^^........",
  "..o.o...^^^^^^^^^^^^^^^rrrr^^^^^^^^^^^^^........",
  "...o.o..^^^^^^^^^^^^^^^rrrr^^^^^^^^^^^^^........",
  "..o.o...^^^^^^^^^^^^^^^rrrr^^^^^^^^^^^^^........",
  "...o.o..^^^^^^^^^^^^^^^rrrr^^^^^^^^^^^^^........",
  "..o.o...................r.......................",
  "...o.o...............11.r.......................",
  "........................r.......................",
  "......^^^^^^^^...........r......................",
  ".........................r......................",
  ".........................r..11..................",
  "........................r.......................",
  "........................r.......................",
  "....o.o.o...............r.......................",
  ".....o.o.........1......r......1................",
  "....o.o.o...............r.................o.o...",
  ".....o.o................r................o.o....",
  "....o.o.o....nnnn..nn...r..nnnn..nnn......o.o...",
  ".....o.o......nn........r...nn....n......o.o....",
  "........................r.................o.o...",
  "........................r................o.o....",
  "............11.........r..........11............",
  "...........bb...bb.....r........................",
  "..........bbb...bb.....r.......bb...bb..........",
  ".........bbbb...bbb....r.......bb...bbb.........",
  "........bbbbb...bbbb...r......bbb...bbbb........",
  ".......bbbb.......bb....r....bbbb...bbbbb.......",
  ".....bbbbb........bbb...r...bbb.......bbbb......",
  ".....bbbb..........bb...r...bbb........bbbbb....",
  ".....bbboo.oo.......bbb.r.bbbb..........bbbb....",
  ".....bb.o.oo........bbb.r.bbb............bbb....",
  ".........oo.o........bb.r.bb.........oo.o.bb....",
  "........oo.oo........bb.r.bb..11.....oo.o.......",
  "........o.oo......11....r.......................",
  "........................r............oo.o.......",
  "........................r.......................",
  "........................r.......................",
  "........................r.......................",
  "........................r......................."
 ],
 "elevation": [
  "333333333333333333333333333333333333333333333333",
  "333333333333333333333333333333333333333333333333",
  "333333333333333333333333333333333333333333333333",
  "333333333333333333333333333333333333333333333333",
  "333333333333333333333333333333333333333333333333",
  "333333333333333333333333333333333333333333333333",
  "333333333333333333333333333333333333333333333333",
  "333333333333333333333333333333333333333333333333",
  "999999998888888888888832222388888888888877899999",
  "999999998888888888888832222388888888888877899999",
  "999999998888888888888832222388888888888877899999",
  "999999998888888888888832222388888888888877899999",
  "999999998888888888888832222388888888888877899999",
  "999999998888888888888832222388888888888877899999",
  "888888888765432111111111111111115556667777788888",
  "888888888765432111111111111111115556667777788888",
  "888888888765432111111111111111115556667777788888",
  "888888999999993331111111111111113334445566788888",
  "888888777766655551111111111111111112344566788888",
  "888888777766655551111111111111111112344566788888",
  "888888777766655551111111111111111112344566788888",
  "888888888765433331111111111111111112344566788888",
  "888888888765432111111111111111111112344566788888",
  "888888888765432111111111111111111112344566788888",
  "888888888765432111111111111111111112344566788888",
  "888888888765433333333333333333333332344566788888",
  "888888888765433333333333333333333332344566788888",
  "888888888765433333333333333333333332344566788888",
  "888888888765432111111111111111111112344566788888",
  "888888888765432111111111111111111112344566788888",
  "777777777654322222222222222222222222233455677777",
  "777777777652122200222222222222222222233455677777",
  "777777777632122200222222222222200222013455677777",
  "777777777432122200022222222222200222011455677777",
  "777777775432122200002222222222000222011255677777",
  "777777755434322222002222222220000222011235677777",
  "777775555454322222000222222200022222231233677777",
  "777775555654322222200222222200022222233233457777",
  "777775557654322222220002220000222222233433457777",
  "777775577654322222220002220002222222233453457777",
  "777777777654322222222002220022222222233455457777",
  "777777777654322222222002220022222222233455677777",
  "777777777654322222222222222222222222233455677777",
  "777777777654321000000000000000000001233455677777",
  "777777777654321000000000000000000001233455677777",
  "777777777654321000000000000000000001233455677777",
  "777777777654321000000000000000000001233455677777",
  "777777777654321000000000000000000001233455677777"
 ]
}
