{
  "id": "beit_sahwan_2",
  "name": "Beit Sahwan \u2014 The Western Terraces",
  "width": 48,
  "height": 48,
  "terrain": "arid",
  "rows": [
    "................bbb.............................",
    "................bbb.............................",
    "................bbb...^^^....=...=oooorro=......",
    ".............^^.bbb...1^^....=...=....rr.ss.....",
    "..........ooo^^obbb..o^^^1oo.=...=oooorross.sss.",
    ".............^^.bbb..........sss.=....rr.=..sss.",
    "..........osssoobbb..ooooooo.sss.=ossorro=......",
    "...........sss...............=...=.ss.rr.=......",
    "..........ooo=oo.....ooooooo.=...=oooorrohh.....",
    "...nn...............rrrrrrrrrrrrrrrrrrrr.hh..ss.",
    "....nn.^^.ooo=oobbb..oooo....=...=....rr.=...ss.",
    ".....n.^^=...=..bbb..o.oo....hh..ss...rr.=......",
    "oo.......=..oooobbb..ooo.....hh..ss...rr.=......",
    "oo......1=.oooo.bbb..........=...=....rr.ss.....",
    "........1..ooo...bbb..ooo....=...=....rr.s......",
    "........1=...=...bbb..ooo....=...=....rr.s...ss.",
    "........2=...=...bbb.===.==..=...=.hhhrr.=...ss.",
    "........2=...=...bbb.........=...=.hhhrr.=......",
    "........1=======.bbb.1oooooo.ss..=....rr.=sss...",
    ".........=...=...bbb......1..ss..=....rr.=sss...",
    ".........=...=...............=........rr........",
    ".........rrrrrrrrrrrrrrrrrrrrrrrrrrrrrrrrrrrrrrr",
    ".........rrrrrrrrrrrrrrrrrrrrrrrrrrrrrrrrrrrrrrr",
    ".........=..sss.............hh...hhh..rr........",
    "........1=..sss..bbb.ooo1ooohhooohhh..rr.ss.....",
    "........2=...=...b..........hh........rr.ss.....",
    "........2=...=...b...osssooo.=ooo=....rr.=......",
    "........1===.===.bbb..sss....=...=.ss.rr.======.",
    "........1=...=...bbb1osssooo.=sss=.ss.rr.=......",
    ".................bbb.........=sss=....rr.=.sss..",
    ".........=.oooo..bbb.=..===..=...=....rr.=.sss..",
    "........1=oo.oo..bbb.........=...=....rr.=......",
    "........1=ooooo..bbb.oo.ooo..sss.=....rr.=......",
    "........1=oooo...bbb.oooooo..sss.=ss..rr.ss.....",
    "........^^...=....bbboooo.o..=...=ss..rr.ss..ss.",
    "........^^...=....bbb......1.=...=....rr.=...ss.",
    "........^^sss=...............=...=....rr.=......",
    "...nn.....sss.......rrrrrrrrrrrrrrrrrrrr........",
    "...nnn....ooo.oo........ooo..ss.......rr.ss.....",
    ".............=....bbb..oooo..ss..sss..rr.ss.....",
    "......n...ooo=oo..bbb..oooo..=...sss..rr.ss.....",
    ".....^^^.....=....bbb^^ooo...=...=....rr.=...ss.",
    ".....^^^..ooo=oo..bbb^^......=...=aaaarr.=...ss.",
    ".............=^^..bbb^^.....sss..=aaaarr.sss....",
    "..........ooo=^^..bbb1oo^^^osss..=aaaarr.sss....",
    "..............^^..bbb...^^^..=...=....rr.=......",
    "..................bbbooooooo....................",
    "..................bbb..........................."
  ],
  "elevation": [
    "222222222222211100000000000001111222222223333333",
    "222222222222211100000000000001111222222223333333",
    "222222222222211100000033300001111222222223333333",
    "222222222222233100000033300001111222222223333333",
    "222222222222233100000033300001111222222223333333",
    "222222222222233100000000000001111222222223333333",
    "333332222222211100000000000001111222222223333333",
    "333332222222211100000000000001111222222223333333",
    "333332222222211100000000000001111222222223333333",
    "333333322222211100000000000001111222222223333333",
    "333333333222211100000000000001111222222223333333",
    "333333333222211100000000000001111222222223333333",
    "333333322222211100000000000001111222222223333333",
    "333333332222211100000000000001111222222223333333",
    "333333332222211100000000000001111222222223333333",
    "333333332222211100000000000001111222222223333333",
    "333333333222211100000000000001111222222223333333",
    "333333333222211100000000000001111222222223333333",
    "333333333222211100000000000001111222222223333333",
    "333333333222211100000000000001111222222223333333",
    "333333333222211100000000000001111222222223333333",
    "333333333222211100000000000001111222222223333333",
    "333333333222211100000000000001111222222223333333",
    "333333333222211100000000000001111222222223333333",
    "333333333222211100000000000001111222222223333333",
    "333333333222211100000000000001111222222223333333",
    "333333333222211100000000000001111222222223333333",
    "333333333222211100000000000001111222222223333333",
    "333333333222211100000000000001111222222223333333",
    "333333333222211100000000000001111222222223333333",
    "333333333222211100000000000001111222222223333333",
    "333333332222211100000000000001111222222223333333",
    "333333332222211100000000000001111222222223333333",
    "333333332222211100000000000001111222222223333333",
    "333333323322211100000000000001111222222223333333",
    "333333323322211100000000000001111222222223333333",
    "333333323322211100000000000001111222222223333333",
    "333333322222211100000000000001111222222223333333",
    "333332222222211100000000000001111222222223333333",
    "333332222222211100000000000001111222222223333333",
    "333332222222211100000000000001111222222223333333",
    "333333332222211100000330000001111222222223333333",
    "222223332222211100000330000001111222222223333333",
    "222222222222213300000330000001111222222223333333",
    "222222222222213300000000333001111222222223333333",
    "222222222222213300000000333001111222222223333333",
    "222222222222211100000000000001111222222223333333",
    "222222222222211100000000000001111222222223333333"
  ],
  "markers": {
    "kdf_assembly": [
      4,
      23
    ],
    "town_center": [
      38,
      22
    ],
    "mortar_line": [
      44,
      24
    ],
    "wounded_evac": [
      1,
      23
    ]
  },
  "zones": {
    "west_approach": [
      0,
      12,
      16,
      24
    ],
    "tunnel_mouth_west": [
      30,
      23,
      3,
      3
    ]
  },
  "tunnels": [
    {
      "id": "bs_tn_west",
      "mouth": [
        31,
        24
      ],
      "waypoints": [
        [
          27,
          23
        ],
        [
          22,
          22
        ]
      ],
      "vent": [
        18,
        25
      ],
      "dig_tiles_per_s": 0.12
    }
  ]
}
