{
  "id": "khan_rafid_3",
  "name": "Khan Rafid \u2014 The Garden Souk",
  "width": 48,
  "height": 48,
  "terrain": "arid",
  "grove": "olive",
  "rows": [
    ".............................................r..",
    ".........============...................aa...r..",
    ".........=.ss....www=........ss.........aa...r..",
    ".........=.......www=...................ww...r..",
    "ss.ss....=wwww......=..........aa...s...ww...r..",
    ".........=wwww.ss...=..........aa....ss......r..",
    "...ss....=..........=........................r..",
    ".........=====.======.....ss..hhh............r..",
    "..............r..............................r..",
    ".hh...........r..............................r..",
    "..............rrrrrrrrrrrrrrrrrrrrrrrrrrrrrrrr..",
    "..............r...ss.sssrss..ss...r.............",
    "..............r......ss.r.s.ss.ss.r.............",
    "...=========..r..sss..s.r.....ss..r.=========...",
    "...=ooo.ooo=..r.sssssss.r.....ss..r.=ooo.ooo=...",
    "...=ooo.ooo=..r...s.....rs.sss..s.r.=ooo.ooo=...",
    "...=oo...oo=..r.s....s..r.......s.r.=oo...oo=...",
    "...=..........r....s....r...s.....r.=.......=...",
    "...=oo...oo=..rrrrrrrrrrrrrrrrrrrrr.=oo...oo=...",
    "...=ooo.ooo=..r.........r.........r.=ooo.ooo=...",
    "...=ooo.ooo=..r.sss.....r......s..r.=ooo.ooo=...",
    "...=========..r.........r.s..ssss.r.====.====...",
    "..............r.........r..sss.ss.r.............",
    "..............r.s....sssr..ss.ss..r.............",
    "..............r.s.s.ss..r.ss...ss.r.............",
    "..............r.....ssssr.ss...ss.r.............",
    "rrrrrrrrrrrrrrrrrrrrrrrrrrrrrrrrrrrrrrrrrrrrrrrr",
    "........................r.......................",
    "........................r.ss....................",
    "...=======.====..ss.....r.......................",
    "...=.ss.......=.........r.s..www....=========...",
    "...=..........=.........r....www....=ooo.ooo=...",
    "...=.mmm....1.=...ss....r...........=ooo.ooo=...",
    "...=.mmm..........ss.ss.r...ss..hh..=oo...oo=...",
    "...=..........=.........r...................=...",
    "...=.1........=.........r..ss.......=oo...oo=...",
    "...=...1......=.s..ss...r...........=ooo.ooo=...",
    "...============....ss...r...........=ooo.ooo=...",
    "........................r......ss...=========...",
    "........................r.......................",
    "........................r.......................",
    ".....www................r.......................",
    ".....www................r..........wwwhh........",
    "........................r..........www..........",
    "...ss...................r.............ss........",
    ".....ssss...www.........r..........ss...........",
    "............www.........r..........hh...........",
    "........................r......................."
  ],
  "markers": {
    "kr_start": [
      24,
      45
    ],
    "main_street": [
      24,
      26
    ],
    "kr_west_edge": [
      1,
      26
    ],
    "kr_east_edge": [
      46,
      26
    ],
    "civ_refuge": [
      10,
      35
    ],
    "ward_gate": [
      14,
      33
    ],
    "ward_north_gate": [
      10,
      29
    ],
    "souk_alley": [
      24,
      18
    ],
    "west_lane": [
      14,
      17
    ],
    "east_lane": [
      34,
      17
    ],
    "north_road": [
      45,
      2
    ],
    "store_gate": [
      14,
      8
    ],
    "wounded_evac": [
      23,
      46
    ]
  },
  "zones": {
    "staging": [
      14,
      42,
      21,
      6
    ],
    "ward": [
      3,
      29,
      12,
      9
    ],
    "souk": [
      16,
      11,
      17,
      14
    ],
    "store": [
      9,
      1,
      12,
      7
    ],
    "orchard_west": [
      3,
      13,
      9,
      9
    ],
    "orchard_east": [
      36,
      13,
      9,
      9
    ],
    "orchard_south": [
      36,
      30,
      9,
      9
    ]
  }
}
