{
 "id": "tel_marum_3",
 "name": "Tel Marum — The Massif",
 "width": 48,
 "height": 48,
 "terrain": "highland",
 "markers": {
  "start_line": [
   24,
   44
  ],
  "hollow": [
   22,
   19
  ],
  "approach": [
   29,
   36
  ],
  "saddle_wide": [
   33,
   16
  ],
  "saddle_narrow": [
   10,
   14
  ],
  "pass": [
   33,
   11
  ],
  "overwatch_east": [
   36,
   12
  ],
  "overwatch_west": [
   30,
   12
  ],
  "battery_position": [
   25,
   6
  ],
  "town_edge": [
   25,
   2
  ],
  "sarim_west": [
   8,
   4
  ],
  "wounded_evac": [
   23,
   46
  ]
 },
 "zones": {
  "pass": [
   30,
   9,
   7,
   5
  ],
  "overwatch_east": [
   35,
   11,
   3,
   3
  ],
  "overwatch_west": [
   29,
   11,
   3,
   3
  ],
  "approach": [
   26,
   35,
   8,
   4
  ],
  "town_block": [
   24,
   3,
   3,
   2
  ],
  "muster_ground": [
   22,
   42,
   5,
   4
  ]
 },
 "rows": [
  ".........................r......................",
  ".........................r......................",
  "............oo...........r......................",
  "........................###.............oo......",
  "..............11........###.....................",
  ".....................s...r...s.....11...........",
  ".........................r......................",
  ".................h....s..r...s..................",
  "..................h......r.................oo...",
  "..^oo^^^^^...............rrrrrrrrr......^^^^o^^.",
  "..^o^^^^^^....^^^^^hh............r......^^^^^^^.",
  "..^^^^^^^^....^^^^^^h............r......^^^^^^^.",
  "..^^^nn^^^....^^^^^^nnh.hh.......r....nn^^^^^^^.",
  "..^^^^^^^^bb..^^^^^^^...........rrr.....^^^^^^^.",
  "^^^^^^^^..bb..^^^^^^^^^^^^^^^^^^rrr^^^^^......^^",
  "^^^^^^^^..bb..^^^^^^^^^^^^^^^^^^rrr^^^^^......^^",
  "^^^^^^^^^^bb^^...^^^^^^^^^^^^^^^rrr^^^^^^^^^^^^^",
  "^^^^^^^^^^bb^^...^^^^^^^^^^^^^^^rrr^^^^^^^^^^^^^",
  "^^^^^^^^^^bb^^.o.^^rrrrrrrrrrrrrrrr^^^^^^^^^^^^^",
  "^^^^^^^^^^bb^^.o.^^rrrrrrrrrrrrrrrr^^.......^^^^",
  "^^^^^^^^^^bb^^.n.^^rrrrrrrrrrrrrrrr^^.......^^^^",
  "^^^bbbbbbbbb^^.n.^^rrr^^^^^^^^^^^^^^^.oo....^^^^",
  "^^^bbbbbbbbb^^o..^^rrr^^^^^^^^^^^^^^^....oo.^^^^",
  "^^^bb^^^^^^^^^..o^^rrr^^^^^^^^^^^^^^^.......^^^^",
  "^^^bb^^^^^^^^^...^^rrr^^^^^^^^^^^^^^^.o..nn.^^^^",
  "^^^bb^^^^^^^^^...^^rrr^^^^^^^^^^^^^^^..oo...^^^^",
  "^^^bbbbb^^^^^^.o.^^rrrrrrrrrrrrrr^^^^.......^^^^",
  "^^^bbbbb^^^^^^...^^rrrrrrrrrrrrrr^^^^.......^^^^",
  "^^^^^^bb^^^^^^...^^rrrrrrrrrrrrrr^^^^^^^^^^^^^^^",
  "^^^^^^bb^^^^^^o..^^^^^^^^^^^^^rrr^^^^^^^^^^^^^^^",
  "^^^bbbbb^^^^^^..o^^^^^^^^^^^^^rrr^^^^^^^^^^^^^^^",
  "^^^bbbbb^^^^^^....^^^^^^......rrr^^^.....^^^^^^^",
  "^^^bb^^^^^^^^^....^^^^^^......rrr^^^.....^^^^^^^",
  "^^^bb^^^^^^^^^....^^^^^^......rrr^^^.....^^^^^^^",
  ".^^bb.......^^^^^^^.^^^^^^.....r......^^^^^^^^..",
  ".^^bb.......^^^^^^^.^^^^^^.....r......^^^^^^^^..",
  ".^^.........^^^^^^^............r......^^nn^^^^..",
  ".^^.........^^nn^^^............r......^^^^^^^^..",
  ".^oo......oo.......11..........r.oo...oo^^^^^^..",
  ".^o.......o................nn..r..oo...o........",
  ".^^............................r...........11...",
  ".....11.................rrrrrrrr................",
  ".................oo.....r.......................",
  "..................o.....r...........nn..........",
  "........nn............oor.................oo....",
  ".......................or........11..........oo.",
  "............11......nn..r.......................",
  "........................r......................."
 ],
 "elevation": [
  "444444444444444444444444444444444444444444444444",
  "444444444444444444444444444444444444444444444444",
  "444444444444444444444444444444444444444444444444",
  "444444444444444444444444444444444444444444444444",
  "444444444444444444444444444444444444444444444444",
  "444444444444444444444444444444444444444444444444",
  "444444444444444444444444444444444444444444444444",
  "444444444444444444444444444444444444444444444444",
  "444444444444444444444444444444444444444444444444",
  "446666666644444444444444444444444444444466666664",
  "446666666644446666644444444444444444444466666664",
  "446666666644446666664444444444444444444466666664",
  "446666666644446666666444444444444444444466666664",
  "446666666633446666666444444444444444444466666664",
  "777777773333337777777777777777774447777733333377",
  "777777773333337777777777777777774447777733333377",
  "777777777733775557777777777777774447777777777777",
  "888887777733775557777777777777774447777777777777",
  "777777777733775557733333333333334447777777777777",
  "777777777733775557733333333333334447755555557778",
  "777777777733775557733333333333334447755555557778",
  "777333333333775557733377777777777777755555557778",
  "777333333333775557733377777777777777755555557778",
  "777337777777775557733377777777777777755555557778",
  "777337777777775557733377777777777777755555557778",
  "777337777777775557733377777777777777755555557778",
  "777333337777775557733322222222222777755555557778",
  "777333337777775557733322222222222777755555557778",
  "777777337777775557733322222222222777777777777778",
  "777777337777775557777777777777222777777777777778",
  "777333337777775557777777777777222777777777777778",
  "777333337777775553777777333333222777333337777777",
  "777337777777773333777777333333222777333337777777",
  "777337777777773333777777333333222777333337777777",
  "266332222222666666625555552222222222226666666622",
  "266332222222666666625555552222222222226666666622",
  "266222222222666666622222222222222222226666666622",
  "266222222222666666622222222222222222226666666622",
  "266222222222222222222222222222222222226666666622",
  "266222222222222222222222222222222222222222222222",
  "266222222222222222222222222222222222222222222222",
  "222222222222222222222222222222222222222222222222",
  "222222222222222222222222222222222222222222222222",
  "222222222222222222222222222222222222222222222222",
  "222222222222222222222222222222222222222222222222",
  "222222222222222222222222222222222222222222222222",
  "222222222222222222222222222222222222222222222222",
  "222222222222222222222222222222222222222222222222"
 ]
}
