{
  "id": "beit_sahwan_outskirts",
  "name": "Beit Sahwan \u2014 Outskirts",
  "width": 48,
  "height": 48,
  "rows": [
    "................................................",
    "................................................",
    "................................................",
    "................................................",
    "................................................",
    "................................................",
    "................................................",
    "................................................",
    ".................1..............................",
    "...........................222222...............",
    ".................1.........2hhhh2....o.o.o......",
    "...........................2hhhh2...oooo..o.....",
    ".................1.........2hhhh2...oo.o..o.....",
    "...........................222222...oo.oo.o.....",
    ".........o.ooo...1.............rr...ooo.o.o.....",
    ".........o..ooo................rr2222222........",
    "........o.oo..o..1.............rr2aaaaa2........",
    "........oooo.o.....22222.......rr2aaaaa2........",
    "........oo..ooo..1.2mmm2.......rr2aaaaa2........",
    "........ooooo.o....2mmm2.......rr2aaaaa2........",
    "........oooooo...1.2mmm2.......rr2222222........",
    "...................rrrrrrrrrrrrrrrrrrrrrr.......",
    "..........111111.1.rrrrrrrrrrrrrrrrrrrrrr.......",
    "..........................rr.222222.............",
    ".................1........rr.2kkkk2.............",
    "..........................rr.2kkkk2.............",
    ".................1........rr.2kkkk2.............",
    "..........................rr.2kkkk2.....n.n.n...",
    ".................1........rr.222222........n..n.",
    ".....................22222rr.......222222n.n.nn.",
    "......n.n.n......1...2sss2rr.......2hhhh2..n..n.",
    "......nnnnn..........2sss2rr.......2hhhh2n....n.",
    ".........n.n.....1...2sss2rr.......2hhhhn.nnn...",
    ".......n...n.........22222rr.......22222n.nn.nn.",
    "......n..nnn.....1........rr....................",
    "......nn...n.............22222222...............",
    ".................1.......2aaaaaa2...............",
    ".........................2aaaaaa2...............",
    ".................1.......2aaaaaa2...............",
    ".........................22222222...............",
    "..................o.o.o..oo.....................",
    "......................o..o......................",
    "..................o..ooooo......................",
    "..................ooo.ooo.o.....................",
    "..................ooo.ooo.o.....................",
    "................................................",
    "................................................",
    "................................................"
  ],
  "markers": {
    "kdf_assembly": [
      4,
      23
    ],
    "town_center": [
      31,
      22
    ],
    "mortar_line": [
      44,
      24
    ],
    "civ_refuge": [
      22,
      45
    ],
    "civ_collection": [
      29,
      33
    ],
    "wounded_evac": [
      1,
      22
    ]
  },
  "zones": {
    "town": [
      19,
      9,
      22,
      31
    ],
    "west_approach": [
      0,
      8,
      17,
      32
    ],
    "clinic": [
      29,
      23,
      6,
      6
    ],
    "tunnel_mouth_west": [29, 21, 3, 3],
    "shaft_head": [25, 12, 3, 3],
    "collection_point": [28, 32, 4, 3]
  },
  "tunnels": [
    {
      "id": "bs_tn_west",
      "mouth": [
        30,
        22
      ],
      "waypoints": [
        [
          24,
          22
        ],
        [
          18,
          22
        ]
      ],
      "vent": [
        7,
        22
      ],
      "dig_tiles_per_s": 0.16
    },
    {
      "id": "bs_tn_north",
      "mouth": [27, 13],
      "waypoints": [[29, 15]],
      "vent": [32, 17],
      "pre_dug": true
    },
    {
      "id": "bs_tn_souk",
      "mouth": [22, 29],
      "waypoints": [[24, 27]],
      "vent": [26, 24],
      "pre_dug": true
    },
    {
      "id": "bs_tn_clinic",
      "mouth": [35, 26],
      "waypoints": [[33, 23]],
      "vent": [31, 21],
      "pre_dug": true
    }
  ]
}
